{
  "package_format": "gkos-conformance-evidence-package",
  "package_version": "0.1-draft",
  "package_id": "7c4f4c8a-3a2e-4c1d-8b9f-3f68a9167b42",
  "created_at": "2026-09-02T21:00:00.000000Z",
  "created_by": {
    "actor_id": "urn:gkos:actor:fixture-builder-001",
    "actor_class": "service",
    "implementation": {
      "name": "gkos-cep-fixture-builder",
      "version": "0.1.0"
    }
  },
  "carrier": {
    "kind": "directory",
    "profile": "gkos-directory-0.1-draft",
    "media_type": "application/vnd.gkos.evidence-package.v0.1+directory",
    "manifest_digest_locator": "package-manifest.sha256"
  },
  "standard": {
    "gkos_release": "GKOS-2026-08-20 v0.80",
    "standard_commit": "1f5768fe6b8f847c17030127a3a00e78edf5cd80",
    "gkx_version": "2.0",
    "canonical_profile": "GKX-CBOR-1",
    "requirement_registry_sha256": "sha256:1111111111111111111111111111111111111111111111111111111111111111",
    "applicability_map_sha256": "sha256:2222222222222222222222222222222222222222222222222222222222222222",
    "diagnostic_registry_sha256": "sha256:3333333333333333333333333333333333333333333333333333333333333333"
  },
  "claim_manifest": {
    "path": "claim/conformance-manifest.json",
    "sha256": "sha256:4444444444444444444444444444444444444444444444444444444444444444",
    "media_type": "application/json"
  },
  "human_report": {
    "path": "claim/conformance-report.md",
    "sha256": "sha256:5555555555555555555555555555555555555555555555555555555555555555",
    "media_type": "text/markdown"
  },
  "inventory_rules": {
    "path_separator": "/",
    "path_encoding": "UTF-8",
    "ordering": "utf8-bytewise-path",
    "absolute_paths_allowed": false,
    "parent_traversal_allowed": false,
    "symlinks_allowed": false,
    "unlisted_files_allowed": false,
    "case_sensitive": true
  },
  "entries": [
    {
      "path": "claim/conformance-manifest.json",
      "role": "claim-manifest",
      "media_type": "application/json",
      "bytes": 128,
      "sha256": "sha256:4444444444444444444444444444444444444444444444444444444444444444",
      "inclusion": "required"
    },
    {
      "path": "claim/conformance-report.md",
      "role": "human-report",
      "media_type": "text/markdown",
      "bytes": 256,
      "sha256": "sha256:5555555555555555555555555555555555555555555555555555555555555555",
      "inclusion": "required"
    },
    {
      "path": "results/raw/runner.txt",
      "role": "raw-output",
      "media_type": "text/plain",
      "bytes": 64,
      "sha256": "sha256:6666666666666666666666666666666666666666666666666666666666666666",
      "inclusion": "required",
      "producer": {
        "name": "gkos-ts-runner",
        "version": "development",
        "commit": "1f5768fe6b8f847c17030127a3a00e78edf5cd80"
      }
    }
  ],
  "omissions": [],
  "external_evidence": [],
  "attestations": [],
  "limitations": [
    "Informative package-format fixture only; no GKOS profile is claimed."
  ],
  "exceptions": [],
  "verification": {
    "tool": {
      "name": "gkos-cep-verifier",
      "version": "0.1.0"
    },
    "instructions_locator": "README.md"
  }
}
